رقم_المشهد,الوقت,المكان_نوع,المكان_اسم,الشخصية,الحوار,عدد_الكلمات
15,ليل,داخلي,,حسين,في ايه يا رافت ؟ مالك رافت : في ايه انت اللي مالك .. احنا ما عدناش بنعمل اي حاجة فى حياتنا .. غير الكباريه حسين : يا رأفت امن الدولة مفتح عنيه قوي اليومين دول علينا .. ده غير ان اللي بيحصل في الاتحاد .. موقف الحركة في كل العالم كله .. هنشتغل احنا رأفت : طب بما ان الحركة واقفة  في العالم كله .. الشيكات اللي بتطلع كل اول شهر دي .. بتطلع ليه ؟ .. بيتعمل بيها ايه حسين : في ناس لازم نضمن ولائهم .. لحد ما وقت الجد يجي ينفخ رأفت بحنق وهو ينظر الى حسين رأفت : اميرة جوا ؟ حسين : لا  ما جتش النهارده رأفت : ده تهريج بقى ... هو اه كباريه .. بس شغل برضه يدخل احد العاملين ليتجه الى حسين العامل : تليفون عشانك يا استاذ حسين حسين : مين ؟ العامل : ما قالش رأفت : اتفضل يا مستر اكس .. روح رد يمشي حسين مبتعدا بينما يتابعه رافت رأفت : شكلك  هتطلع في اخر الفيلم رئيس العصابة يا حسين يا يعقوب مشهد 17									ليل- داخلي شقة اميرة   – الصالة تقف اميرة تنظر الى سمرة باستغراب وقد اخذت سمرة ترتب الصاله وتفرغها من الاثاث  وقد  تم وضع مدخنة ضخمة في منتصف الصالة اميرة : كودية زار يا امة ؟.. انتي بتهرجي ؟ سمرة : مالها كودية الزار .. ولا هو لا كده عاجب ولا كده عاجب اميرة : كده ايه وكده ايه يا امة.. هو لو ما كنش البطال يبقى الغلط سمرة : والله يا بنت بطني انا لا دكتورة عندها عيانين .. ولا ابلة  بتدي دروس ... ده اللي بعرف اعمله اميرة : بس انا ماشوفتكيش بتدقي زار قبل كده وهي تتجه لتجلس على الارض لتستريح سمرة : وحياتك ما زار بس وهفتح مندل وهفك اعمال .. وهقرا الفنجان ما بقاش سمرة لو ما كنتش هكسب من الشغلانة دي قد اللي كنت بكسبه م التسريح عشر مرات اميرة : يا امة  ليه كل ده ... احنا ما عدنش محتاجين فلوس .. انا بشتغل وكلها شهور وهتجوز رأفت .. ليه بقى البهدلة دي سمرة : عشان انا ما اتعودتش حد يصرف عليا .. وما تتكليش قوي على الفلاح .. مش دايملك تنظر لها اميرة باستغراب اميرة : تقصدي ايه يا امة تصمت سمرة قليلا وفجأة يرن الهاتف سمرة : ما اقصودش .. روحي ردي ع التليفون تذهب اميرة الى الهاتف لترد عليه  وقد بدا عليها القلق اميرة : الو .. ايوة يا رافت,395
18,ليل,داخلي,,نور,قطتي بتحب على نفسها كريم : نور بلاش تريقة على مشاعري .. عادي جدا انك ما تحسهاش بس بلاش تتريقي عليها يبدو على نور الاحراج نور : انا ما قصدش يا كريم .. انا بس مش متخيلة انك لسه .. ده عدا اكتر من سنتين كريم : عبيط بقى .. اعمل ايه نور : كريم ما تبقاش رخم وتقلب الليلة غم كريم : ولا غم ولا نيلة اقعدي خليني اقولك اللي انا عايزك فيه تجلس نور وتنظر الى كريم باستفسار كريم : الراجل بتاعنا خلاص .. قرر ينتج بفرحة نور : بتتكلم جد كريم : ومش هينتج لاي حد ... بعد ما شافك في الفيلم الاخير .. تقدري تقولي مبروك لنفسك انتي بطلة الفيلم الجاي تنهض نور كالمجنونة من الفرحة وتنهض كريم لتحضنه نور : انت اكتر واحد بحبه في الدنيا يا كريم .. اكتر واحد والله يغلق كريم عينيه ويتنهد وهو في حضنها فتتركه نور : وده هيحصل امتى كريم : عايزين ورق حلو انا كلمت وحيد حامد و  محمود ابو زيد و بشير الديك  وهنشوف نور : وانا في حد في دماغي كده .. ياالا انا هسيبك دلوقتي  ونتكلم بكره يا قطتي يا قمر انت يا وش السعد يبتسم كريم ويتابعها وهي تخرج ثم يجلس متنهدا ويمد يده ليشغل الكاسيت مرة اخرى ليخرج صوت عمرو دياب مغنيا مشهد22								ليل-خارجي شارع  امام شركة انتاج – سيارة سليم عثمان يجلس سليم عثمان في سيارته امام مدخل العمارة بينما تخرج نور من العمارة وتنظر الى سيارته قليلا ثم تتجه الى السيارة وتدور حولها لتفتح الباب وسط دهشة سليم البسيطة وتعلق الباب خلفها نور : انت ايه حكايتك  بقى .. يوم افتتاح الفيلم في ريفولي قعدت مركز معايا .. قولت سيبك منه يمكن من اللي بيحبوا البحلقة .. لكن من ساعتها ما اروحش في حتة الا لما القيك فيها ؟.. لا  الموضوع مش موضوع بحلقة يبتسم سليم ابتسامة خفيفة سليم : وفرتي عليا كتير ... تحبي تتعشي ؟ تنظر له نور بدهاء نور : هتعشيني فين ؟ سليم : هو انتي اللي هتدفعي نور : تؤ وهو يدير سيارته سليم : يبقى ما تسأليش ينطلق سليم بسيارته مبتعدا مشهد23								ليل-داخلي السجن  – غرفة يجلس مدحت ومعه مأمور السجن  ويبدو على مدحت التوتر المأمور : برضه مصر ما تشربش حاجة يا مدحت باشا مدحت : شارب قبل ما اجي ومش قادر المأمور : بس المشوار طويل مدحت : معلهش يطرق احدهم على الباب ليفتحه فيدخل عسكري ومعه   يحي فينهض مدحت ليسلم على يحي مدحت : ازيك يا عم يحي يحي : ازيك يا مدحت باشا ينهض المأمور المأمور : هرجعلك بعد شوية يخرج المأمور بينما يجلس الاثنان مدحت : ازيك يا عم يحي يحي : انا الحمد لله يا ابني .. انت عامل ايه وطارق عامل ايه ؟ مدحت : هو ما بيجلكش ولا ايه ؟ يحي : انا مانعه .. وضعه حساس .. وهو بيحط رجله في اول طريق مستقبله .. مالهاش لازمة يتلط بيا مدحت : ربنا يخليكوا لبعض ... هو كويس .. انت عارف اني مش متدين قوي فمبسمعوش  .. بس اللي انا فاهمه ان كل الميكروباصات مشغلة خطبه يحي : الحمد لله مدحت : اؤمرني ياعم يحي .. انا اول ما قالولي انك عايزني .. طلبت زيارة وجيت على طول ينظر يحي الى عيني مدحت قليلا يحي : انا مش عايز اكتر من حقي مستغربا مدحت : يعني ايه ؟ يحي : انت فاهم كويس قوي .. اني عارف ان انت اللي هربت الست القوادة من الحبس .. وانا يومها سكت عشان ما كنش ينفع اتكلم .. وهو كله حاجة عدت والموضوع هدي.. وخلاص انا شيلتها بس  زي ما قولتلك .. انا عايز حقي .. عايز تمن الحبسة .. قرشين احطهم في البنك .. ما هو انا هطلع لا في معاش ولا في شغل بحدة مدحت : انت اتجننت يا يحي ولا الحبسة اكلت دماغك يحي : لا دي ولا دي .. انا عارف انا بقول ايه .. وانت عارف ان كلامي صح .. اه  ما اقدرش اثبته .. بس على الاقل ابني هيصدقني يصمت محدت وهو ينظر الى يحي الذي ينهض ليتجه الى الباب ويطرق عليه يحي : حدد انت الرقم .. ومش هفاصل معاك يا ... يا مدحت مشهد24								ليل-داخلي مطعم مطعم راقي يجلس فيه عدة زبائن بينما يجلس في احد الاركان نور وسليم بينما في الخلفية نسمع موسيقى هادئة reflection of passion  for yanni نور : معجب ؟.. يا حسرة ده همه فيلمين تلاتة و دور بس اللي فيهم عدل سليم : الموهبة مش محتاجة ميت دور نور : موهبة .. اه .. ما تجيبلي دوغري احسن .. انا من الناس اللي بيجوا بالدوغري سليم : وهو في اكتر من كده دوغري .. من ربع ساعه ما كناش نعرف بعض .. دلوقتي قعدين نتعشا نور : اه  ده انت هتغلبني .. طب بقولك ايه محفظتك مليانة ؟ بثقة سليم : اكيد,765
18,ليل,داخلي,,نور,طيب تنهض نور مبتسمة وتتكلم برقة وبصوت مرتفع قليلا نور : I am so sorry .... اني بزعجكوا .. انا النهارده عيد ميلادي والنهارده سمعت احلى خبر في حياتي في بيبي جاي في الطريق .. فبليز انا حابة اشارك الدنيا كلها فرحتي .. فارجوكوا انا عايزة اعزم كل الرستوران على العشا يهمم رواد المكان فتمثل نور الرقة الشديدة وهي تضع يدها على بطنها نور : بليز مش عشاني … it is for him ينظر لها سليم بدهشة بينما تعود نور لتجلس امامه وتطرق بأصابعها نور : متر .. ال menu ثم تنظر الى سليم نور : كنا بنقول ايه يا ... هو انت اسمك ايه ؟ مشهد 25									ليل- داخلي شقة نهال   –  غرفة نهال تجلس نهال على مكتب بالغرفة وقد وضعت امامها هيدفون فضى اللوم ماركو سونى وامسكت في يدها شريط كاسيت خارج منه الشريط الفضي  و قلم و ووضعت القلم في دائرة الشريط واخذت تلفه ببطئ حت استوى الشريط البني بداخله  ووضعت الشريط داخل الكاسيت و ووضعت السماعات على اذنيها وادارت الشريط  ثم امسكت بالقلم ونظرت الى الورقة امامها وكتبت بسم الله الرحمن الرحيم مشهد 26									ليل- داخلي امام باب شقة نهال تصعد نور على السلم لتجد سليم في انتظارها امام شقة نهال نور : لا انا كده بقى بدات اخاف .. واخرك معايا الجزمة .. انت عايز  مني ايه ؟ وهو يناولها  شال سليم : نسيتي ده في المطعم .. جيت ادهولك نور : وانت عرفت اني جاية هنا ازاي ؟ سليم : انا اقدر اعرف كل حاجة ثم يتركها وينزل على السلم ولكنه يتوقف كأنه تذكر شيء فيخرج من جيبه وردة حمراء سليم : وكمان نسيت اديكي دي يتركها وينزل بعد ان اخذت منه الوردة واخذت تتابعه ثم تضع يدها على الجرس لترن وهي مازالت تتابعه مشهد 27									ليل- داخلي شقة نهال   –  غرفة نهال تدخل نور الى غرفة نهال التي كانت تجلس على مكتبها وعلى اذنيها سماعة الهيد فون وتجري بسرعه على الشباك لتفتحه وتقف تنظر من خلاله تستغرب نهال بشدة وتخلع السماعات نهال : في ايه  يا نور نور : مش عارفة.. واحد طلعلي كده من تحت الارض .. مخليني .. مش .. مش عارفة يا نهال نهال : ده مي نده اللي مخلي نور توفيق مش على بعضها كده .. ده  انا ادفع نص عمري واشوفه تنهض نهالى لتقف بجوار نور في الشباك وتنظر الى الشارع الخالي ثم تنظر الى الوردة في يد نور نهال : وهو اللي مديكي الوردة دي ؟ تهز نور رأسها بالايجاب نهال : واضح ان الموضوع كبير .. الا ايه صح اللي فكرك بيا ؟ نور : جيالك في شغل تضحك نهال نهال : هتضربي مين وعايزاني انشر نور : لا انا عايزاكي في حاجة تانية ... انا خلاص هاخد اول بطولة وبندور على ورق نهال : ده خبر حلو قوي .. الف مبروك نور : وبصراحة انا عايزاكي انتي اللي تكبيلي السيناريو .. ما حدش هيشوفني صح وهيحطني في الحطة اللي انا عايزها غيرك .. ده غير ان الحكايات اللي بتقعدي تحكهالي وانت محششة كانت بتبقى تحفة تنظر نهال الى الباب نهال : صوتك الله يخرب بيتك ثم تعود تنظر الى نور نهال : والله يا نور انتي جايلي في يوم انا اخدة قرار فيه اني ابتدي اكتب اول رواية في حياتي نور : شوفتي الفال .. بدل ما تبقى رواية خليها سيناريو تبتسم نهال برقة نور : همشي انا بقى عشان اتاخرت .. ونتكلم بعدين في التفاصيل تمشي نور تجاه الباب ومعها نهال بينما نرى نحن الورقة التي كتبت عليها نهال من قبل بسم الله الرحمن الرحيم خالية تماما الا من رسمة وردة,567
28,ليل,داخلي,,فريد,دي كمبيالات ضد ... ثم يخرج دفتر شيكات ويرميه امامه فريد : ودي شيكات بكل ارصدتي في كل البنوك ممضية لحامله .. اخر شيك بس اللي باسمك ... ده مكافئتك حسين : انا مش فاهم حاجة فريد : خلال اسبوع من دلوقتي .. تلملي كل فلوسي اللي في البنوك .. مش انت بس اللي تسحب ... وتطلعهم بره البلد بطرقك .. وهنتقابل في روما ..  تسلمني الفلوس .. اسلمك الكمبيالات الضد حسين : هو في حاجة بتحصل ولا ايه ؟ فريد : وانت من امتى بتسأل .. انت مش ليك شيكاك حسين : عندك حق يبدأ حسين في توقيع الكمبيالات فريد : خلي بالك يا حسين .. انا فريد هجرس ... يعني بلاش شيطانك يلعب بيك .. عشان هجيبك حسين : يا فريد باشا انا بتاعك لحد  اخر يوم يا في عمري يا في عمرك مشهد29								ليل-خارجي شارع  امام عمارة نور – سيارة سليم عثمان تقف نور امام باب عمارتها تنظر الى سيارة سليم عثمان وهو بداخلها نور : كده  كتير سليم : نسيت اديكي رقم تليفوني ثم يخرج  ويمدها لها بورقه فتنظر له قليلا ثم تقترب وتتناولها منه بينما يدير هو سيارته نور : و رقمي ؟ سليم : معايا ينطلق سليم بسيارته مبتعدا بينما هي تنظر اليه وتتابعه,200
40,نهار,داخلي,,عباد الله,"إننا في زمن تتلاطم أمواجه بأنواع الشرور, وكثيراً ما يتعرض المؤمن فيه لموجات كلها فتن وبلاء وزور, من أشدها وأخطرها فتنة النساء التي خشيها علينا نبينا عليه الصلاة والسلام، والتي حذرنا منها بقوله في الحديث الصحيح: [ إن الدنيا حلوة خضرة، وإن الله مستخلفكم فيها فينظر كيف تعملون، فاتقوا الدنيا واتقوا النساء، فإن أول فتنة بني إسرائيل كانت في النساء.. فاتقوا الله أيها الإخوة المؤمنون، واحذروا الخلوة بأي امرأة ليست بمحرم، احذروا متابعة النظر فيما لا يحل، احذروا الخلوة بما لا يحل، احذروا الاستماع إلى الأصوات الفاتنة والداعية لتحرك الغرائز مما لا تحل من النساء",95
47,ليل,داخلي,,طارق,انا اسف اني  جاي من غير ميعاد,7
47,ليل,داخلي,,نور,ايه يا طارق عيب اللي انت بتقوله ده  بيت .... اختك ثم تضحك ضحكتها المعتاد فيبتسم طارق رغم عنه بينما هو يدخل طارق : بس مش عايز اعطلك شكلك خارجة نور : وزارة الخارجية عاملة حفلة بمناسبة تحرير طابا .. وانا معزومة اصلي بقيت من علية القوم .. بس لو ما فضتلكش افضى لمين ؟ طارق : انا جاي عايز نصيحتك,61
